<?xml version="1.0" encoding="UTF-8"?>
<!DOCTYPE emails SYSTEM "./emails.dtd">
<!-- <emails 
xmlns="http://www.w3schools.com/"
xmlns:xsi="http://www.w3.org/2001/XMLSchema"
xsi:schemaLocation="http://www.w3schools.com emails.xsd"> -->
<emails>
    <email>
        <to>Vimal</to>
        <from>Sonoo</from>
        <heading>Hello</heading>
        <body>Hello brother, how are you!</body>
    </email>
    <email>
        <to>Peter</to>
        <from>Jack</from>
        <heading>Birth day wish</heading>
        <body>Happy birth day Tom!</body>
    </email>
</emails>